{
  "$schema": "https://json-schema.org/draft/2020-12/schema",
  "$id": "https://projecta.example/schemas/s12-f-rf-internal-poc-review.v5.json",
  "title": "Sprint 12 F-RF Agent-Proxy Review v5",
  "type": "object", "additionalProperties": false,
  "required": ["artifactVersion", "status", "candidatePath", "candidateDigest", "payloadPath", "payloadDigest", "reviewerMode", "humanEvidence", "providerCalls", "heldOutInspection", "records", "metrics", "nonClaims", "reviewDigest"],
  "properties": {
    "artifactVersion": {"const": "s12.f-rf.internal-poc-review.v5"}, "status": {"const": "EDIT_BURDEN_ONLY_ACCEPTED_AGENT_PROXY"}, "candidatePath": {"const": "evaluation/sprint-12/internal-poc/s12-f-rf-internal-poc-candidate.v5.json"}, "candidateDigest": {"const": "sha256:09679f2cccae8eaf6477e5b1c3dc3baaf0767441f6bbc0a67b3b103b3d1affa1"}, "payloadPath": {"const": "evaluation/sprint-12/internal-poc/s12-f-rf-blinded-source-payload.v5.json"}, "payloadDigest": {"const": "sha256:461c22c4adb8b493389c18278925408b4f9b41b3f02035d48f7d8d30e1182ef4"}, "reviewerMode": {"const": "PRIMARY_AGENT_PROXY_OWNER_JUDGMENT"}, "humanEvidence": {"const": false}, "providerCalls": {"const": 0}, "heldOutInspection": {"const": false}, "records": {"type": "array", "minItems": 12, "maxItems": 12, "items": {"$ref": "#/$defs/record"}}, "metrics": {"$ref": "#/$defs/metrics"}, "nonClaims": {"type": "array", "minItems": 3, "items": {"type": "string", "minLength": 1}}, "reviewDigest": {"pattern": "^sha256:[0-9a-f]{64}$"}
  },
  "$defs": {
    "record": {"type": "object", "additionalProperties": false, "required": ["recordId", "caseId", "scenarioId", "sourceDigest", "candidateDigest", "reviewerMode", "humanEvidence", "finalDisposition", "correctionClass", "semanticEditCount", "reason", "timingStatus", "manualBaselineSeconds", "independentAgreement", "unsupportedFinalizedAssertions", "supportedFinalizedAssertions"], "properties": {"recordId": {"pattern": "^poc-review-v5-[0-9]{3}$"}, "caseId": {"pattern": "^s12-a-[0-9]{4}$"}, "scenarioId": {"pattern": "^s12-s-[0-9]{3}$"}, "sourceDigest": {"pattern": "^sha256:[0-9a-f]{64}$"}, "candidateDigest": {"pattern": "^sha256:[0-9a-f]{64}$"}, "reviewerMode": {"const": "PRIMARY_AGENT_PROXY_OWNER_JUDGMENT"}, "humanEvidence": {"const": false}, "finalDisposition": {"const": "confirmed"}, "correctionClass": {"const": "unchanged"}, "semanticEditCount": {"const": 0}, "reason": {"type": "string", "minLength": 1}, "timingStatus": {"const": "UNMEASURED"}, "manualBaselineSeconds": {"type": "null"}, "independentAgreement": {"const": "NOT_CLAIMED"}, "unsupportedFinalizedAssertions": {"const": 0}, "supportedFinalizedAssertions": {"const": 5}}},
    "metricCount": {"type": "object", "additionalProperties": false, "required": ["numerator", "denominator", "status"], "properties": {"numerator": {"type": "integer", "minimum": 0}, "denominator": {"type": "integer", "minimum": 0}, "status": {"type": "string"}}},
    "metricRate": {"type": "object", "additionalProperties": false, "required": ["numerator", "denominator", "rate", "threshold"], "properties": {"numerator": {"const": 12}, "denominator": {"const": 12}, "rate": {"const": 1.0}, "threshold": {"type": "number", "minimum": 0, "maximum": 1}}},
    "metrics": {"type": "object", "additionalProperties": false, "required": ["eligibleReviewedItems", "supportedFinalizedAssertions", "unsupportedFinalizedAssertions", "acceptedWithoutSemanticCorrection", "acceptedUnchangedOrMinor", "totalSemanticEdits", "meanSemanticEditsPerReviewedItem", "medianReviewTimeSeconds", "p90ReviewTimeSeconds", "medianReductionVsManualBaseline", "timingStatus", "reviewerAgreement", "gateStatus"], "properties": {"eligibleReviewedItems": {"const": 12}, "supportedFinalizedAssertions": {"allOf": [{"$ref": "#/$defs/metricCount"}, {"properties": {"numerator": {"const": 60}, "denominator": {"const": 60}, "status": {"const": "SUPPORTED_SOURCE_BOUND"}}}]}, "unsupportedFinalizedAssertions": {"allOf": [{"$ref": "#/$defs/metricCount"}, {"properties": {"numerator": {"const": 0}, "denominator": {"const": 60}, "status": {"const": "ZERO_UNSUPPORTED"}}}]}, "acceptedWithoutSemanticCorrection": {"$ref": "#/$defs/metricRate"}, "acceptedUnchangedOrMinor": {"$ref": "#/$defs/metricRate"}, "totalSemanticEdits": {"const": 0}, "meanSemanticEditsPerReviewedItem": {"const": 0.0}, "medianReviewTimeSeconds": {"type": "null"}, "p90ReviewTimeSeconds": {"type": "null"}, "medianReductionVsManualBaseline": {"type": "null"}, "timingStatus": {"const": "UNMEASURED"}, "reviewerAgreement": {"type": "object", "additionalProperties": false, "required": ["status", "independentRecords"], "properties": {"status": {"const": "NOT_CLAIMED"}, "independentRecords": {"const": 0}}}, "gateStatus": {"const": "EDIT_BURDEN_ONLY_ACCEPTED_AGENT_PROXY"}}}
  }
}
