{
  "artifactVersion": "s12.f-rf.internal-poc-review.v5",
  "candidateDigest": "sha256:09679f2cccae8eaf6477e5b1c3dc3baaf0767441f6bbc0a67b3b103b3d1affa1",
  "candidatePath": "evaluation/sprint-12/internal-poc/s12-f-rf-internal-poc-candidate.v5.json",
  "heldOutInspection": false,
  "humanEvidence": false,
  "metrics": {
    "acceptedUnchangedOrMinor": {
      "denominator": 12,
      "numerator": 12,
      "rate": 1.0,
      "threshold": 0.85
    },
    "acceptedWithoutSemanticCorrection": {
      "denominator": 12,
      "numerator": 12,
      "rate": 1.0,
      "threshold": 0.7
    },
    "eligibleReviewedItems": 12,
    "gateStatus": "EDIT_BURDEN_ONLY_ACCEPTED_AGENT_PROXY",
    "meanSemanticEditsPerReviewedItem": 0.0,
    "medianReductionVsManualBaseline": null,
    "medianReviewTimeSeconds": null,
    "p90ReviewTimeSeconds": null,
    "reviewerAgreement": {
      "independentRecords": 0,
      "status": "NOT_CLAIMED"
    },
    "supportedFinalizedAssertions": {
      "denominator": 60,
      "numerator": 60,
      "status": "SUPPORTED_SOURCE_BOUND"
    },
    "timingStatus": "UNMEASURED",
    "totalSemanticEdits": 0,
    "unsupportedFinalizedAssertions": {
      "denominator": 60,
      "numerator": 0,
      "status": "ZERO_UNSUPPORTED"
    }
  },
  "nonClaims": [
    "primary-agent proxy judgment is not independent human-study evidence",
    "timing, manual baseline, reviewer agreement, external custody, and business-quality are not claimed",
    "no provider, held-out, production, selection, promotion, release, or external-validation claim"
  ],
  "payloadDigest": "sha256:461c22c4adb8b493389c18278925408b4f9b41b3f02035d48f7d8d30e1182ef4",
  "payloadPath": "evaluation/sprint-12/internal-poc/s12-f-rf-blinded-source-payload.v5.json",
  "providerCalls": 0,
  "records": [
    {
      "candidateDigest": "sha256:92ac5c6da40d12829061cc4f124360e0e939c63bfc0d5f5db6e49bc9410e41e7",
      "caseId": "s12-a-4099",
      "correctionClass": "unchanged",
      "finalDisposition": "confirmed",
      "humanEvidence": false,
      "independentAgreement": "NOT_CLAIMED",
      "manualBaselineSeconds": null,
      "reason": "owner confirmed all source-anchored entities and relations as supported",
      "recordId": "poc-review-v5-001",
      "reviewerMode": "PRIMARY_AGENT_PROXY_OWNER_JUDGMENT",
      "scenarioId": "s12-s-213",
      "semanticEditCount": 0,
      "sourceDigest": "sha256:c5c0d47f1fc27bad9931f8a33e95836bf39e02ab3d68abf0b81a7ebd699814de",
      "supportedFinalizedAssertions": 5,
      "timingStatus": "UNMEASURED",
      "unsupportedFinalizedAssertions": 0
    },
    {
      "candidateDigest": "sha256:2bbaf4f660e3bab81102d8b9c533dc72ef61012ba87039da26e78848066e8635",
      "caseId": "s12-a-4107",
      "correctionClass": "unchanged",
      "finalDisposition": "confirmed",
      "humanEvidence": false,
      "independentAgreement": "NOT_CLAIMED",
      "manualBaselineSeconds": null,
      "reason": "owner confirmed all source-anchored entities and relations as supported",
      "recordId": "poc-review-v5-002",
      "reviewerMode": "PRIMARY_AGENT_PROXY_OWNER_JUDGMENT",
      "scenarioId": "s12-s-214",
      "semanticEditCount": 0,
      "sourceDigest": "sha256:b4fbc3cfb231bab11ac48159862549a807ee9cc244cfe8edeb6fa3578f33e757",
      "supportedFinalizedAssertions": 5,
      "timingStatus": "UNMEASURED",
      "unsupportedFinalizedAssertions": 0
    },
    {
      "candidateDigest": "sha256:e47ee7f5efe7e5e491f865693f597696495fae02485efb0c0808fa992b72b1a0",
      "caseId": "s12-a-4115",
      "correctionClass": "unchanged",
      "finalDisposition": "confirmed",
      "humanEvidence": false,
      "independentAgreement": "NOT_CLAIMED",
      "manualBaselineSeconds": null,
      "reason": "owner confirmed all source-anchored entities and relations as supported",
      "recordId": "poc-review-v5-003",
      "reviewerMode": "PRIMARY_AGENT_PROXY_OWNER_JUDGMENT",
      "scenarioId": "s12-s-215",
      "semanticEditCount": 0,
      "sourceDigest": "sha256:5bace08c5bc7f43e54b2797f1f197c9d8ecf647abebd6eace12090570f3e4593",
      "supportedFinalizedAssertions": 5,
      "timingStatus": "UNMEASURED",
      "unsupportedFinalizedAssertions": 0
    },
    {
      "candidateDigest": "sha256:8f7078e899bc5fd7f6ae7679f7d894dcce4ede195111541e18eba42fea36ef08",
      "caseId": "s12-a-4123",
      "correctionClass": "unchanged",
      "finalDisposition": "confirmed",
      "humanEvidence": false,
      "independentAgreement": "NOT_CLAIMED",
      "manualBaselineSeconds": null,
      "reason": "owner confirmed all source-anchored entities and relations as supported",
      "recordId": "poc-review-v5-004",
      "reviewerMode": "PRIMARY_AGENT_PROXY_OWNER_JUDGMENT",
      "scenarioId": "s12-s-216",
      "semanticEditCount": 0,
      "sourceDigest": "sha256:58c62daade82e64f52e4e6a7d85db3d87c8801e6faa1d9583b3fb52efe381c9e",
      "supportedFinalizedAssertions": 5,
      "timingStatus": "UNMEASURED",
      "unsupportedFinalizedAssertions": 0
    },
    {
      "candidateDigest": "sha256:b0e811d6336c6b2398aada1663136f58255fd5b21819038e81fd7833f4de57c6",
      "caseId": "s12-a-4131",
      "correctionClass": "unchanged",
      "finalDisposition": "confirmed",
      "humanEvidence": false,
      "independentAgreement": "NOT_CLAIMED",
      "manualBaselineSeconds": null,
      "reason": "owner confirmed all source-anchored entities and relations as supported",
      "recordId": "poc-review-v5-005",
      "reviewerMode": "PRIMARY_AGENT_PROXY_OWNER_JUDGMENT",
      "scenarioId": "s12-s-217",
      "semanticEditCount": 0,
      "sourceDigest": "sha256:c4b3058aeede76d0aca4c6043b27fcfbdf61a0e6fde3e2eb04cd1e50416993a1",
      "supportedFinalizedAssertions": 5,
      "timingStatus": "UNMEASURED",
      "unsupportedFinalizedAssertions": 0
    },
    {
      "candidateDigest": "sha256:dfe103dba085a0b0425255233a84128c0c7081c4b27998c06444b367c10744cd",
      "caseId": "s12-a-4139",
      "correctionClass": "unchanged",
      "finalDisposition": "confirmed",
      "humanEvidence": false,
      "independentAgreement": "NOT_CLAIMED",
      "manualBaselineSeconds": null,
      "reason": "owner confirmed all source-anchored entities and relations as supported",
      "recordId": "poc-review-v5-006",
      "reviewerMode": "PRIMARY_AGENT_PROXY_OWNER_JUDGMENT",
      "scenarioId": "s12-s-218",
      "semanticEditCount": 0,
      "sourceDigest": "sha256:99c726dfe29d3570b6cd0611799b0a070a560ded762d04896428eccfbe1cde35",
      "supportedFinalizedAssertions": 5,
      "timingStatus": "UNMEASURED",
      "unsupportedFinalizedAssertions": 0
    },
    {
      "candidateDigest": "sha256:8451c8086ef05832446baf201c85c4e3b2f430286cbd115b9a1eab207630283e",
      "caseId": "s12-a-4147",
      "correctionClass": "unchanged",
      "finalDisposition": "confirmed",
      "humanEvidence": false,
      "independentAgreement": "NOT_CLAIMED",
      "manualBaselineSeconds": null,
      "reason": "owner confirmed all source-anchored entities and relations as supported",
      "recordId": "poc-review-v5-007",
      "reviewerMode": "PRIMARY_AGENT_PROXY_OWNER_JUDGMENT",
      "scenarioId": "s12-s-219",
      "semanticEditCount": 0,
      "sourceDigest": "sha256:ca86afb2ab3e19d9a9db63d79a7a52ce0bd8979e7fef06e9d3ed2217866ea360",
      "supportedFinalizedAssertions": 5,
      "timingStatus": "UNMEASURED",
      "unsupportedFinalizedAssertions": 0
    },
    {
      "candidateDigest": "sha256:567643db85c543fe99d5a2a7abef391f997fdd03d56afdf18970d8d65018c60e",
      "caseId": "s12-a-4155",
      "correctionClass": "unchanged",
      "finalDisposition": "confirmed",
      "humanEvidence": false,
      "independentAgreement": "NOT_CLAIMED",
      "manualBaselineSeconds": null,
      "reason": "owner confirmed all source-anchored entities and relations as supported",
      "recordId": "poc-review-v5-008",
      "reviewerMode": "PRIMARY_AGENT_PROXY_OWNER_JUDGMENT",
      "scenarioId": "s12-s-220",
      "semanticEditCount": 0,
      "sourceDigest": "sha256:cafa5068dc0cfb6e65e01c2ffc11cfb4b6c368a97c3c34a0a2cdff64214fbae2",
      "supportedFinalizedAssertions": 5,
      "timingStatus": "UNMEASURED",
      "unsupportedFinalizedAssertions": 0
    },
    {
      "candidateDigest": "sha256:b22cd3f4a70707ebe1bcecdf7b58647df2a79f920a58342898d4577f99e79edf",
      "caseId": "s12-a-4163",
      "correctionClass": "unchanged",
      "finalDisposition": "confirmed",
      "humanEvidence": false,
      "independentAgreement": "NOT_CLAIMED",
      "manualBaselineSeconds": null,
      "reason": "owner confirmed all source-anchored entities and relations as supported",
      "recordId": "poc-review-v5-009",
      "reviewerMode": "PRIMARY_AGENT_PROXY_OWNER_JUDGMENT",
      "scenarioId": "s12-s-221",
      "semanticEditCount": 0,
      "sourceDigest": "sha256:101023eae7af986b1dc6998ebf95fa971af6c85dfc796d4ba8e5c175c729a39d",
      "supportedFinalizedAssertions": 5,
      "timingStatus": "UNMEASURED",
      "unsupportedFinalizedAssertions": 0
    },
    {
      "candidateDigest": "sha256:682b0bfdebc80fd9ac9b206d4e92997414be35b957457442fee38d4d15f5e1b0",
      "caseId": "s12-a-4171",
      "correctionClass": "unchanged",
      "finalDisposition": "confirmed",
      "humanEvidence": false,
      "independentAgreement": "NOT_CLAIMED",
      "manualBaselineSeconds": null,
      "reason": "owner confirmed all source-anchored entities and relations as supported",
      "recordId": "poc-review-v5-010",
      "reviewerMode": "PRIMARY_AGENT_PROXY_OWNER_JUDGMENT",
      "scenarioId": "s12-s-222",
      "semanticEditCount": 0,
      "sourceDigest": "sha256:9085b554a51c0b48b1c0b00538467ff06e00e46696103075018cf60bcab15c15",
      "supportedFinalizedAssertions": 5,
      "timingStatus": "UNMEASURED",
      "unsupportedFinalizedAssertions": 0
    },
    {
      "candidateDigest": "sha256:228e3be5fa5b700db779ea3df3e61d76bbf9619c7d96e381ca621b744845cb7d",
      "caseId": "s12-a-4179",
      "correctionClass": "unchanged",